{
  "$schema": "https://json-schema.org/draft/2020-12/schema",
  "$id": "https://moolam.ai/schemas/bindings-vision.prescription-sketch.v1.json",
  "title": "Prescription sketch extraction",
  "description": "VisionInterface responseSchema for a single photographed prescription sketch. Fields drug, dose, and frequency are nullable when illegible — never invent medications, doses, frequencies, or diagnoses. Single page only (pageIndex must be 0).",
  "schemaVersion": "bindings-vision.prescription-sketch.v1",
  "type": "object",
  "additionalProperties": false,
  "required": [
    "schemaVersion",
    "documentKind",
    "pageIndex",
    "confidence",
    "lines",
    "partial"
  ],
  "properties": {
    "schemaVersion": {
      "type": "string",
      "const": "bindings-vision.prescription-sketch.v1"
    },
    "documentKind": {
      "type": "string",
      "const": "prescription-sketch"
    },
    "prescriberName": {
      "type": ["string", "null"],
      "description": "Prescriber name when readable; null when unknown — never invent."
    },
    "datedOn": {
      "type": ["string", "null"],
      "description": "Date string when readable; null when unknown."
    },
    "pageIndex": {
      "type": "integer",
      "const": 0,
      "description": "Caller passes one page image; multi-image batches are rejected."
    },
    "confidence": {
      "type": "number",
      "minimum": 0,
      "maximum": 1,
      "description": "Overall extraction confidence."
    },
    "lines": {
      "type": "array",
      "maxItems": 64,
      "description": "Bounded medication lines; empty when nothing readable.",
      "items": {
        "type": "object",
        "additionalProperties": false,
        "required": ["index", "confidence"],
        "properties": {
          "index": {
            "type": "integer",
            "minimum": 1,
            "maximum": 64
          },
          "drug": {
            "type": ["string", "null"],
            "description": "Drug name when readable; null when illegible — never invent."
          },
          "dose": {
            "type": ["string", "null"],
            "description": "Dose text when readable; null when illegible — never invent."
          },
          "frequency": {
            "type": ["string", "null"],
            "description": "Frequency text when readable; null when illegible — never invent."
          },
          "duration": {
            "type": ["string", "null"],
            "description": "Duration when readable; null when unknown."
          },
          "confidence": {
            "type": "number",
            "minimum": 0,
            "maximum": 1
          }
        }
      }
    },
    "partial": {
      "type": "boolean",
      "description": "true when extraction is incomplete (low resolution, crop, or unresolved fields)."
    },
    "unresolvedFields": {
      "type": "array",
      "maxItems": 64,
      "items": { "type": "string", "minLength": 1, "maxLength": 128 },
      "description": "Dotted paths left unknown without hallucination (no diagnoses)."
    }
  }
}

